ProgramName,Degree,Program,ProgID,TotalCredits,EmphasisName,CatalogType,CatalogYear,Description,SeriesHeading,Group_CategoryTitle,Group_CategoryNotes,GroupCredits,SubjectAbbreviation,CourseNumber,Course,Title,Credits,PreReq,CoReq,DiverseCultures
Community Health Worker,CERT,Community Health Worker - CERT,202322883,16,,Undergraduate,2024-2025,Major Common Core,,,,,HLTH,101,HLTH 101,Health and the Environment,3,,,
Community Health Worker,CERT,Community Health Worker - CERT,202322883,16,,Undergraduate,2024-2025,Major Common Core,,,,,HLTH,102,HLTH 102,Health Promotion Competencies for the Community Health Worker,2,HLTH 101,,
Community Health Worker,CERT,Community Health Worker - CERT,202322883,16,,Undergraduate,2024-2025,Major Common Core,,,,,HLTH,201,HLTH 201,"The Community Health Worker: Role, Advocacy, Outreach, and Resources",3,,,
Community Health Worker,CERT,Community Health Worker - CERT,202322883,16,,Undergraduate,2024-2025,Major Common Core,,,,,HLTH,202,HLTH 202,"Health Communication, Teaching, and Capacity Building",3,,,
Community Health Worker,CERT,Community Health Worker - CERT,202322883,16,,Undergraduate,2024-2025,Major Common Core,,,,,HLTH,203,HLTH 203,"Documentation, Legal, and Ethical Issues in Community Health Work",3,,,
Community Health Worker,CERT,Community Health Worker - CERT,202322883,16,,Undergraduate,2024-2025,Major Common Core,,,,,HLTH,296,HLTH 296,Internship: Community Health Worker,1-2,"HLTH 101, HLTH 201, HLTH 202, HLTH 203",,
